{
  "schema_version": "2.0",
  "loop_id": "L102",
  "generated_at": "2026-07-30T17:30:12.207641Z",
  "source": {
    "goal_sha256": "13acebf30f6a014adc7371310190bcb2ba351076cd1ed643c3e56e5efe6a5f09",
    "plan_version": 1,
    "plan_sha256": "b752a2df33e35a241bb420facd5922d9785e0056dd4a9338564ebf8a5e0af09b",
    "journal_last_seq": 7,
    "journal_tail_id": "decision-next-1"
  },
  "projection": {
    "loop_status": "active",
    "node_states": {
      "N1": "done",
      "N2": "pending"
    },
    "ready_nodes": [
      "N2"
    ],
    "active_nodes": [],
    "waiting_nodes": [],
    "current_evidence_refs": {
      "criterion:SC1": [
        "ev-implementation"
      ],
      "node:N1": [
        "ev-implementation"
      ]
    },
    "open_context_ids": [
      "risk-cold-resume"
    ],
    "pending_authorization_refs": [],
    "in_doubt_effect_ids": []
  },
  "recovery_refs": {
    "confirmed_evidence": [
      "ev-implementation"
    ],
    "recent_records": [
      "rec-plan-1",
      "rec-transition-1",
      "ev-implementation",
      "rec-transition-2",
      "rec-transition-3",
      "ctx-risk-1",
      "decision-next-1"
    ],
    "latest_next_action_decision": "decision-next-1"
  }
}
